{"artifact_digest":"sha256:cb50ff32fd01e101dcc979c8b349a4a75b6d3aa4c94c827e13fab3d9c5857ffe","created_at":"2026-10-15T07:54:47.936654Z","files":[{"content_digest":"sha256:8bda5e1f230f34246f973d94db9e7f0607dec08d97018f55f30952cfcec42d99","ref":"benchmarks/context/scope_v1.json"},{"content_digest":"sha256:0d74a701e560f63620d23ab5bf28468671447892d96bbae7b1f21885d55f0e55","ref":"benchmarks/holdout/discount_scope_samples.json"},{"content_digest":"sha256:dd807b2e49a5c37cd07721a7991b2210f9a32868fb94792a8d43fcf8b7d2779b","ref":"benchmarks/holdout/validation_scope_samples.json"},{"content_digest":"sha256:5fe41e5a03e75f8fe352998838eff3d46d05c4c2bd847bbeaa75ca7453f81a9f","ref":"benchmarks/splits/scope_v1.json"},{"content_digest":"sha256:7831a87faf776215a933143f7d4071c3ae19390e46b78d533c36f3162b2fe1b9","ref":"benchmarks/train/discount_scope_samples.json"},{"content_digest":"sha256:2f428e1350636733ed984e1093206d6ad58ac2aa6c9f363a164db9ae7775afeb","ref":"benchmarks/train/validation_scope_samples.json"},{"content_digest":"sha256:fcadae7d4c4d1d5fbbdf1c85dddf625e8413ecd4f088c5d9a9777939212345d4","ref":"examples/__init__.py"},{"content_digest":"sha256:c7b4729687b65064ee2aee92bab721fbb91bc26ccee59d8bc8ac85b6333a379d","ref":"examples/demo/mvp.yaml"},{"content_digest":"sha256:abf65d5bcdadfdc5c6df3b368c8b9c992fa90d021a88f39e8b0740f8961c8ebf","ref":"examples/demo/requests/discount_agent.json"},{"content_digest":"sha256:9344fe7e733d504f4ca5824f7c3228552c3e98e2da516771fe52c4ca866f8e2b","ref":"examples/demo/requests/query_agent.json"},{"content_digest":"sha256:5bfd485cda188792683253d7c1504f971ce1ee20e0bcd11665807baa78636cb7","ref":"examples/discount/__init__.py"},{"content_digest":"sha256:8658ed2e054b557da714117f6d9242132a88a6dbd6765e11a5a2fd6a8328339d","ref":"examples/discount/contracts/membership_discount_amount_v1.json"},{"content_digest":"sha256:1ae60b9a63a7270ec34ff20da51cebff91d1fb2b682e70066894a5b4c5a69057","ref":"examples/discount/contracts/membership_discount_final_price_v1.json"},{"content_digest":"sha256:4327a875c83208f850c2a2004b12d85d91cbf4a47bd928386c289304a5ebd318","ref":"examples/discount/contracts/membership_discount_final_price_v2.json"},{"content_digest":"sha256:ac0c26622d364f9bfaa856e069c98e3108011224c5945b4d3c932cf54b2d0156","ref":"examples/discount/implementations/__init__.py"},{"content_digest":"sha256:ead26e9312a2266daa4fc5d181fdda118aa513ad500e2815c40660292d96ab93","ref":"examples/discount/implementations/discount_amount_v1_alternate_correct.py"},{"content_digest":"sha256:42d3828eebe257c21e3befe8f1d73451c104eada79e4f35259af36b5e34e67d8","ref":"examples/discount/implementations/discount_amount_v1_correct.py"},{"content_digest":"sha256:7fa5573c89f7f26780a0e272bc7344eb27839fad151afbdbe7694b3abb679e25","ref":"examples/discount/implementations/final_price_v1_alternate_buggy.py"},{"content_digest":"sha256:df250247cfae0ac0347004b73d6d4e4969bbf9726375d0dd560d753407a60d9c","ref":"examples/discount/implementations/final_price_v1_buggy.py"},{"content_digest":"sha256:9aba8ce81dca67b85773b8b8ea5317404e9dda12d84a51085ef8db1d9f5fdcf3","ref":"examples/discount/implementations/final_price_v1_fixed.py"},{"content_digest":"sha256:e2e093a1a9fb6964b8404229e51a273d115271c29ffde015c15b30584f4231db","ref":"examples/discount/implementations/final_price_v2_alternate_correct.py"},{"content_digest":"sha256:09e437c472379d44c87fe79a89e5842881e25f38868a3e12b52207292ebffe50","ref":"examples/discount/implementations/final_price_v2_correct.py"},{"content_digest":"sha256:ef2967fff9b25c18b1169efcb4aa6011902ed22b35aba4b3a37b57a8dd6c0887","ref":"examples/validation/__init__.py"},{"content_digest":"sha256:e871ee758abdf6c2d3d619b112751bf3717846642280cfb3a3dcf3bc257978bd","ref":"examples/validation/contracts/input_limit_batch_v1.json"},{"content_digest":"sha256:40901e4f22bc63b240a0f52a0c29871c92d2a969af8403d0c566e3926f521af5","ref":"examples/validation/contracts/input_limit_query_v1.json"},{"content_digest":"sha256:dd50ec8428b21dd0d9f1120c701d67e341abd55bab8e4854a2a9273cda4157d3","ref":"examples/validation/contracts/input_limit_query_v2.json"},{"content_digest":"sha256:58b46918af3865ffad0bddc8293725c951538c2b753e7ab27559fcba0ceeff86","ref":"examples/validation/implementations/__init__.py"},{"content_digest":"sha256:77299d28d9b01702fb96384b4f5c5a7fd01549c8a70b8f0442efee2e611ffee6","ref":"examples/validation/implementations/batch_limit_v1_alternate_correct.py"},{"content_digest":"sha256:ca976f2b6185f109c2e93068361fe3c4b7b0a980192975c698a9ddb017f01fac","ref":"examples/validation/implementations/batch_limit_v1_correct.py"},{"content_digest":"sha256:37e502a5f627af8d4975819bd231126e948352a9ec2b321a7ef974f13c69690a","ref":"examples/validation/implementations/query_limit_v1_alternate_correct.py"},{"content_digest":"sha256:ddddc788b70dad377047429f4eb9bbd3423fbedad447dd036bc641ec62cf878a","ref":"examples/validation/implementations/query_limit_v1_buggy.py"},{"content_digest":"sha256:1ebcbd76ff9835cd45266801648d2da5be5ac49cbe633b2d51b4cd91909f5243","ref":"examples/validation/implementations/query_limit_v1_fixed.py"},{"content_digest":"sha256:fd07dfdb5c05e39c3eae1a74d3a2c1cdb50f8493a0869463d17e05f54c017448","ref":"examples/validation/implementations/query_limit_v2_alternate_correct.py"},{"content_digest":"sha256:eddbb1190146acb7bd27f45944ab32295e76a8b3b531610a08102116c5a439a3","ref":"examples/validation/implementations/query_limit_v2_buggy.py"},{"content_digest":"sha256:a79eb007f17d7724d344929647976ee0582b05f352a71ab840b54063ba422a2a","ref":"examples/validation/implementations/query_limit_v2_correct.py"},{"content_digest":"sha256:2fdddbe82524c0033a0da76e5ad7085ebe7ed2b45603e06dfcbc551c8aaf5c65","ref":"experiments/scope_v1.json"},{"content_digest":"sha256:5381a9cbbc3a42a95b997491a15ff206c039617abc8aa135270c098ec311251b","ref":"tests/fixtures/agent_responses/discount_v1.json"},{"content_digest":"sha256:494bf573cac4709c1006cbfbf1041cc795be11349aa7b8f066e139eab26e551d","ref":"tests/fixtures/agent_responses/query_v1.json"}],"runtime_ref":"artifacts/freeze-demo/w","scenario_digest":"sha256:c7b4729687b65064ee2aee92bab721fbb91bc26ccee59d8bc8ac85b6333a379d","scenario_ref":"examples/demo/mvp.yaml","schema_version":"pipeline-workspace.v1"}
